{
    "key": "utility",
    "type": "combo",
    "label": "Utility",
    "strings": {
        "options": {
            "gas": "Gas",
            "oil": "Oil",
            "power": "Power",
            "sewerage": "Waste Water",
            "street_lighting": "Street Lighting",
            "telecom": "Telecom",
            "water": "Water"
        }
    }
}
