{
    "key": "healthcare",
    "type": "typeCombo",
    "label": "Type",
    "strings": {
        "options": {
            "pharmacy": "Pharmacy",
            "doctor": "Doctor",
            "clinic": "Clinic",
            "hospital": "Hospital",
            "dentist": "Dentist",
            "physiotherapist": "Physiotherapist",
            "laboratory": "Medical Laboratory",
            "psychotherapist": "Psychotherapist",
            "optometrist": "Optometrist",
            "rehabilitation": "Rehabilitation Facility",
            "podiatrist": "Podiatrist",
            "counselling": "Counselling Center",
            "nurse": "Nurse",
            "speech_therapist": "Speech Therapist",
            "blood_donation": "Blood Donation Center",
            "hospice": "Hospice",
            "occupational_therapist": "Occupational Therapist",
            "dialysis": "Dialysis Center",
            "midwife": "Midwife",
            "sample_collection": "Sample Collection Facility",
            "audiologist": "Audiologist",
            "birthing_centre": "Birthing Center",
            "community_health_worker": "Community Health Worker",
            "vaccination_centre": "Vaccination Center",
            "blood_bank": "Blood Bank",
            "alternative": "Alternative Medicine"
        }
    }
}
