{
    "key": "memorial",
    "type": "combo",
    "label": "Type",
    "strings": {
        "options": {
            "plaque": "Commemorative Plaque",
            "war_memorial": "War Memorial",
            "stolperstein": "Stolperstein",
            "statue": "Statue",
            "stele": "Stele",
            "stone": "Stone",
            "bust": "Bust",
            "sculpture": "Sculpture",
            "obelisk": "Obelisk",
            "cross": "Memorial Cross",
            "blue_plaque": "Blue Plaque",
            "ghost_bike": "Ghost Bike"
        }
    }
}
