{
    "key": "tomb",
    "type": "combo",
    "label": "Type",
    "strings": {
        "options": {
            "columbarium": "Columbarium",
            "crypt": "Crypt",
            "dolmen": "Dolmen",
            "hypogeum": "Hypogeum",
            "mausoleum": "Mausoleum",
            "pyramid": "Pyramid",
            "rock-cut": "Rock-cut Tomb",
            "sarcophagus": "Sarcophagus",
            "table": "Table",
            "tumulus": "Tumulus",
            "vault": "Vault",
            "war_grave": "Single War Grave"
        }
    }
}
