{
    "key": "royal_cypher",
    "type": "combo",
    "label": "Royal Cypher",
    "strings": {
        "options": {
            "VR": "VR (Victoria)",
            "EVIIR": "EVIIR (Edward VII)",
            "EVIIIR": "EVIIIR (Edward VIII)",
            "GR": "GR (George V)",
            "GVIR": "GVIR (George VI)",
            "EIIR": "EIIR (Elizabeth II)",
            "CIIIR": "CIIIR (Charles III)",
            "scottish_crown": "Scottish Crown",
            "no": "No"
        }
    },
    "autoSuggestions": false,
    "customValues": false,
    "locationSet": {
        "include": [
            "gb"
        ]
    }
}
