{
    "key": "surface",
    "type": "combo",
    "label": "Surface",
    "strings": {
        "options": {
            "unpaved": "Unpaved",
            "paved": "Paved",
            "asphalt": "Asphalt",
            "concrete": "Concrete",
            "paving_stones": "Paving Stones",
            "ground": "Ground",
            "gravel": "Gravel",
            "dirt": "Dirt",
            "grass": "Grass",
            "compacted": "Compacted",
            "sand": "Sand",
            "sett": "Sett",
            "fine_gravel": "Fine Gravel",
            "wood": "Wood",
            "concrete:plates": "Concrete Plates",
            "pebblestone": "Pebblestone",
            "grass_paver": "Grass Paver",
            "metal": "Metal",
            "unhewn_cobblestone": "Cobblestone (uncut, rounded stones)",
            "concrete:lanes": "Concrete Lanes",
            "mud": "Persistently Muddy",
            "woodchips": "Woodchips",
            "salt": "Salt",
            "artificial_turf": "Artificial Turf",
            "tartan": "Tartan",
            "clay": "Clay"
        }
    }
}
