{
    "type": "address",
    "key": "addr",
    "reference": {
        "key": "addr:*"
    },
    "keys": [
        "addr:block_number",
        "addr:city",
        "addr:conscriptionnumber",
        "addr:country",
        "addr:county",
        "addr:district",
        "addr:door",
        "addr:floor",
        "addr:hamlet",
        "addr:housename",
        "addr:housenumber",
        "addr:neighbourhood",
        "addr:place",
        "addr:postcode",
        "addr:province",
        "addr:quarter",
        "addr:state",
        "addr:street",
        "addr:subdistrict",
        "addr:suburb",
        "addr:town",
        "addr:unit"
    ],
    "label": "Address",
    "strings": {
        "labels": {
            "conscriptionnumber": "Conscription Number",
            "housenumber": "House Number"
        },
        "placeholders": {
            "block_number": "Block Number",
            "block_number!jp": "Block No.",
            "city": "City",
            "city!cn": "City/Prefecture/League",
            "city!jp": "City/Town/Village/Tokyo Special Ward",
            "city!vn": "City/Town",
            "conscriptionnumber": "123",
            "country": "Country",
            "county": "County",
            "county!jp": "District",
            "district": "District",
            "district!cn": "District/County/Banner",
            "district!vn": "Arrondissement/Town/District",
            "door": "Door Number",
            "floor": "Floor",
            "hamlet": "Hamlet",
            "housename": "Housename",
            "housenumber": "123",
            "housenumber!jp": "Building No./Lot No.",
            "neighbourhood": "Neighborhood",
            "neighbourhood!jp": "Machi/Chōme/Aza/Koaza",
            "place": "Place",
            "postcode": "Postcode",
            "province": "Province",
            "province!cn": "Province/Municipality/AR/SAR",
            "province!jp": "Prefecture",
            "quarter": "Quarter",
            "quarter!jp": "Ōaza",
            "state": "State",
            "street": "Street",
            "subdistrict": "Subdistrict",
            "subdistrict!vn": "Ward/Commune/Townlet",
            "suburb": "Suburb",
            "suburb!jp": "Ward (政令市)",
            "town": "Town",
            "unit": "Unit"
        }
    },
    "terms": [
        "location"
    ]
}
