{
    "key": "telescope:type",
    "type": "combo",
    "label": "Type",
    "strings": {
        "options": {
            "optical": "Optical Telescope",
            "radio": "Radio Telescope"
        }
    },
    "icons": {
        "optical": "temaki-telescope",
        "radio": "roentgen-telescope_radio"
    },
    "autoSuggestions": true,
    "customValues": true
}
