{
    "key": "baby_feeding",
    "type": "radio",
    "label": "Baby Nursing Area",
    "strings": {
        "options": {
            "room": "Dedicated Room",
            "yes": "Marked Space",
            "no": "None"
        }
    },
    "terms": [
        "baby feeding",
        "breastfeeding",
        "lactation",
        "mothers",
        "nursing"
    ]
}
