{
    "key": "surveillance:type",
    "type": "combo",
    "label": "Surveillance Type",
    "strings": {
        "options": {
            "camera": "Camera",
            "guard": "Guard",
            "gunshot_detector": "Gunshot Detector",
            "ALPR": "Automatic License Plate Reader"
        }
    },
    "autoSuggestions": false,
    "customValues": false
}
