{
    "key": "traffic_calming",
    "type": "combo",
    "label": "Traffic Calming",
    "terms": [
        "bump",
        "chicane",
        "choker",
        "cushion",
        "flat top",
        "hump",
        "rumble strip",
        "slow",
        "speed",
        "table",
        "traffic island"
    ],
    "stringsCrossReference": "{traffic_calming}",
    "iconsCrossReference": "{traffic_calming}"
}
