{
    "key": "substation",
    "type": "combo",
    "label": "Type",
    "strings": {
        "options": {
            "transmission": "Transmission",
            "distribution": "Regional Distribution",
            "minor_distribution": "Local Distribution",
            "industrial": "Industrial",
            "compression": "Compression",
            "measurement": "Measurement",
            "valve": "Valve",
            "valve_group": "Valve Group",
            "inspection_gauge": "Inspection Gauge",
            "field_gathering": "Field Gathering"
        }
    },
    "autoSuggestions": false
}
