{
    "key": "craft",
    "type": "typeCombo",
    "label": "Type",
    "strings": {
        "options": {
            "carpenter": "Carpenter",
            "electronics_repair": "Electronics Repair",
            "winery": "Winery",
            "metal_construction": "Metalworker",
            "photographer": "Photographer",
            "electrician": "Electrician",
            "hvac": "HVAC",
            "plumber": "Plumber",
            "brewery": "Brewery",
            "tailor": "Tailor",
            "caterer": "Caterer",
            "shoemaker": "Shoemaker",
            "sawmill": "Sawmill",
            "window_construction": "Window Construction",
            "handicraft": "Handicraft",
            "gardener": "Gardener",
            "joiner": "Joiner",
            "dressmaker": "Dressmaker",
            "confectionery": "Candy Maker",
            "stonemason": "Stonemason",
            "painter": "Painter",
            "glaziery": "Glaziery",
            "beekeeper": "Beekeeper",
            "roofer": "Roofer",
            "builder": "Builder",
            "key_cutter": "Key Cutter",
            "upholsterer": "Upholsterer",
            "cleaning": "Cleaning Service",
            "blacksmith": "Blacksmith",
            "pottery": "Pottery Maker",
            "signmaker": "Signmaker",
            "distillery": "Distillery",
            "agricultural_engines": "Agricultural Engines Mechanic",
            "jeweller": "Jeweller",
            "locksmith": "Locksmith",
            "tiler": "Tiler",
            "photographic_laboratory": "Photographic Laboratory",
            "watchmaker": "Watchmaker",
            "clockmaker": "Clockmaker",
            "floorer": "Floorer",
            "tinsmith": "Tinsmith",
            "grinding_mill": "Grinding Mill",
            "boatbuilder": "Boat Builder",
            "sculptor": "Sculptor",
            "scaffolder": "Scaffolder",
            "plasterer": "Plasterer",
            "oil_mill": "Oil Mill",
            "bookbinder": "Bookbinder",
            "insulation": "Insulator",
            "saddler": "Saddler",
            "chimney_sweeper": "Chimney Sweeper",
            "carpet_layer": "Carpet Layer",
            "parquet_layer": "Parquet Layer",
            "sailmaker": "Sailmaker",
            "basket_maker": "Basket Maker",
            "rigger": "Rigger"
        }
    }
}
